{
    "$schema": "https://json-schema.org/draft/2020-12/schema",
    "$id": "https://protocol.coysh.digital/system.v1.json",
    "title": "system.v1",
    "description": "How a site's runtime is configured and how much room it is using. An allowlist: anything absent is rejected, not ignored. Note what is not here - no paths, no file names, no directory listings, no configuration values beyond the handful of numeric limits below, and nothing about the content of anything measured. A byte count of an assets volume says how much is there; it says nothing about what.\n\nSeparate from inventory.v1 rather than added to it, and behind its own capability. Measuring disk means walking a directory tree, and sampling request timings means the connector observes traffic - both are a different kind of collection from reading a version number, so granting one must be a deliberate act rather than something an existing grant quietly starts doing.",
    "type": "object",
    "additionalProperties": false,
    "required": ["schema_version", "collected_at"],
    "properties": {
        "schema_version": {
            "type": "string",
            "enum": ["system.v1"]
        },
        "collected_at": {
            "description": "Unix timestamp at which the connector gathered this data.",
            "type": "integer"
        },

        "storage": {
            "description": "Sizes of the volumes Craft manages. Labels are a closed set, so a site cannot name a directory here and thereby report a path.",
            "type": "object",
            "additionalProperties": false,
            "properties": {
                "volumes": {
                    "type": "array",
                    "maxItems": 50,
                    "items": {
                        "type": "object",
                        "additionalProperties": false,
                        "required": ["handle", "bytes"],
                        "properties": {
                            "handle": {
                                "description": "The asset volume's handle. Not its path, and not its filesystem type.",
                                "type": "string",
                                "maxLength": 128,
                                "pattern": "^[A-Za-z0-9._-]+$"
                            },
                            "bytes": { "type": "integer", "minimum": 0 },
                            "files": { "type": "integer", "minimum": 0 },
                            "measured": {
                                "description": "False when the volume could not be walked - remote storage, or a tree too large for the time budget. A size of zero and a size nobody could measure are different facts.",
                                "type": "boolean"
                            }
                        }
                    }
                },

                "storage_bytes": {
                    "description": "Craft's own storage directory: logs, caches, compiled templates, backups it has taken itself.",
                    "type": "integer",
                    "minimum": 0
                },
                "disk_free_bytes": { "type": "integer", "minimum": 0 },
                "disk_total_bytes": { "type": "integer", "minimum": 0 }
            }
        },

        "php": {
            "description": "Runtime limits, as numbers. Never phpinfo(), never a path, never an ini file, and never the value of any setting that could name one.",
            "type": "object",
            "additionalProperties": false,
            "properties": {
                "version": { "type": "string", "maxLength": 32 },
                "sapi": { "type": "string", "maxLength": 32 },
                "memory_limit_bytes": {
                    "description": "-1 where the limit is unlimited, which is a real setting and not an error.",
                    "type": "integer",
                    "minimum": -1
                },
                "max_execution_time": { "type": "integer", "minimum": 0 },
                "upload_max_filesize_bytes": { "type": "integer", "minimum": 0 },
                "post_max_size_bytes": { "type": "integer", "minimum": 0 },
                "max_input_vars": { "type": "integer", "minimum": 0 },
                "opcache_enabled": { "type": "boolean" },
                "opcache_memory_used_bytes": { "type": "integer", "minimum": 0 },
                "opcache_memory_free_bytes": { "type": "integer", "minimum": 0 },
                "extensions": {
                    "description": "Count only. The list itself would fingerprint the host in a way a byte count does not.",
                    "type": "integer",
                    "minimum": 0
                }
            }
        },

        "response": {
            "description": "How long the site took to build its own responses, sampled on the site from traffic that was happening anyway. This is server processing time - the connector cannot see network, TLS or queueing - so it is not time to first byte and the interface does not call it that.",
            "type": "object",
            "additionalProperties": false,
            "properties": {
                "samples": { "type": "integer", "minimum": 0 },
                "window_hours": { "type": "integer", "minimum": 1, "maximum": 168 },
                "mean_ms": { "type": "number", "minimum": 0 },
                "p50_ms": { "type": "number", "minimum": 0 },
                "p95_ms": { "type": "number", "minimum": 0 },
                "max_ms": { "type": "number", "minimum": 0 }
            }
        }
    }
}
